item_category,item_name,item_price,price_per_unit,price_per_unit_type,item_size
Maxi pads,H-E-B Maxi Pads - Super,3.98,0.08,ct,48 ct
Maxi pads,H-E-B Maxi with Flexi-Wings Overnight Pads,5.13,0.14,ct,36 ct
Maxi pads,"Always Maxi Overnight Pads with Wings, Extra Heavy Overnight, Unscented Size 5",5.56,0.28,ct,20 ct
Maxi pads,H-E-B Maxi with Flexi-Wings Overnight Pads - Extra Heavy,3.98,0.2,ct,20 ct
Maxi pads,H-E-B Maxi with Flexi-Wings Overnight Pads - Extra Heavy,6.0,0.17,ct,36 ct
Maxi pads,H-E-B Maxi with Flexi-Wings Overnight Pads,3.0,0.11,ct,28 ct
Maxi pads,"Always Maxi Daytime Pads with Wings, Super, Unscented Size 2",7.97,0.19,ct,42 ct
Maxi pads,H-E-B Maxi with Flexi-Wings Long Pads - Super,3.0,0.09,ct,32 ct
Maxi pads,Stayfree Maxi Pads - Super,6.38,0.13,ct,48 ct
Maxi pads,Stayfree Maxi Pads Wingless - Regular,4.43,0.18,ct,24 ct
Maxi pads,U by Kotex Clean & Secure Maxi Pads - Heavy Absorbency,4.18,0.19,ct,22 ct
Maxi pads,Always Maxi Pads Overnight Absorbency Unscented with Wings Size 4,7.97,0.24,ct,33 ct
Maxi pads,Always Maxi Pads Overnight Absorbency Unscented with Wings Size 5,7.97,0.3,ct,27 ct
Maxi pads,"Always Maxi Overnight Pads with Wings - Extra Heavy Size 5, Unscented",10.47,0.29,ct,36 ct
Maxi pads,Carefree Maxi Overnight Pads With Wings,6.68,0.24,ct,28 ct
Maxi pads,"Stayfree Maxi Super Pads For Women, Wingless",4.43,0.18,ct,24 ct
Maxi pads,U by Kotex Clean & Secure Maxi Overnight Pad with Wings - Extra Heavy,8.99,0.37,ct,24 ct
Maxi pads,Frida Mom Instant Ice Maxi Pads for Postpartum Recovery,17.99,2.25,ct,8 ct
Maxi pads,Always Maxi Pads Overnight Absorbency Unscented Size 4,5.56,0.21,ct,26 ct
Maxi pads,"Always Maxi Overnight Pads with Wings for Women, Size 5, Extra Heavy Overnight Absorbency, Unscented, 14 Count",4.67,0.33,ct,14 ct
Maxi pads,U by Kotex Clean & Secure Overnight Maxi Pads,7.68,0.19,ct,40 ct
Maxi pads,U by Kotex Clean & Secure Overnight Maxi Pads,4.18,0.3,ct,14 ct
Maxi pads,Carefree Maxi Super Long Pads with Wings,6.68,0.24,ct,28 ct
Maxi pads,"Always Maxi Daytime Pads with Wings, Extra Long Super, Unscented  Size 3",7.97,0.24,ct,33 ct
Instant coffee,Nescafe Gold Blonde Espresso Instant Coffee,9.24,2.64,oz,3.5 oz
Instant coffee,H-E-B Classic Roast Instant Coffee,5.15,0.64,oz,8 oz
Instant coffee,Nescafe Tasters Choice House Blend Light-Medium Roast Instant Coffee Packets,1.48,0.25,ct,6 ct
Instant coffee,Folgers Classic Roast Instant Coffee,12.84,1.07,oz,12 oz
Instant coffee,Nescafe Gold Espresso Intense Instant Coffee,9.24,2.64,oz,3.5 oz
Instant coffee,Folgers Classic Roast Instant Coffee,8.97,1.12,oz,8 oz
Instant coffee,Folgers Classic Roast Single Serve Instant Coffee Packets,1.46,0.21,ct,7 ct
Instant coffee,H-E-B Cafe Puro Instant Coffee,2.28,1.3,oz,1.76 oz
Instant coffee,Cafe Bustelo Espresso Instant Coffee Packets,1.69,0.28,ct,6 ct
Instant coffee,Folgers Classic Roast Instant Coffee,5.12,1.71,oz,3 oz
Instant coffee,Nescafe Clasico Pure Instant Coffee,3.98,2.34,oz,1.7 oz
Instant coffee,Nescafe Clasico Pure Instant Coffee,6.77,1.93,oz,3.5 oz
Instant coffee,Nescafe Taster's Choice House Blend Instant Coffee,12.57,1.8,oz,7 oz
Instant coffee,Nescafe Clasico Pure Dark Roast Instant Coffee,9.24,1.32,oz,7 oz
Instant coffee,Tejas Cafe H-E-BTexas Café Hazelnut Instant Coffee,5.99,0.75,oz,8 oz
Instant coffee,Central Market Organics Instant Coffee,6.28,1.78,oz,3.5 oz
Instant coffee,Via Romo Espresso Instant  Coffee,2.78,1.39,oz,2 oz
Instant coffee,Nescafe Tasters Choice French Roast Instant Coffee,12.57,1.8,oz,7 oz
Instant coffee,H-E-B Classic Decaf Instant Coffee,7.68,0.96,oz,8 oz
Instant coffee,Tejas Cafe H-E-B Chocolate Instant Coffee,5.99,0.75,oz,8 oz
Instant coffee,Tejas Cafe H-E-B Café De Olla Instant Coffee,5.99,0.75,oz,8 oz
Instant coffee,Colcafe Colombian Instant Coffee,4.58,1.53,oz,3 oz
Instant coffee,Caffe D'Vita Premium Mocha Cappuccino Instant Coffee,5.82,0.36,oz,16 oz
Instant coffee,Folgers Coffee Singles Classic Roast Instant Coffee Bags,6.98,0.37,ct,19 ct
Instant coffee,Nescafe Clasico Pure Instant Coffee,13.28,1.26,oz,10.5 oz
Instant coffee,Maxwell House International Cafe French Vanilla Beverage Mix,4.46,0.53,oz,8.4 oz
Instant coffee,Nescafe Tasters Choice Decaf House Blend Light-Medium Roast Instant Coffee Packets,1.48,0.3,ct,5 ct
Instant coffee,Hills Bros. French Vanilla Cappuccino Drink Mix,4.22,0.26,oz,16 oz
Instant coffee,Folgers Classic Decaf Instant Coffee,9.97,1.25,oz,8 oz
Instant coffee,Nescafe Clasico Pure Decaf Dark Roast Instant Coffee,10.74,1.53,oz,7 oz
Instant coffee,Postum Original Roasted Wheat-Bran and Molasses Instant Coffee Alternative,10.68,1.34,oz,8 oz
Instant coffee,Starbucks VIA Ready Brew Colombia Medium Roast Instant Coffee Packets,8.47,1.06,ct,8 ct
Instant coffee,H-E-B Cafe Puro Dark Roast Instant Coffee,5.98,0.85,oz,7 oz
Instant coffee,Colcafe Granulated Instant Coffee,7.98,1.33,oz,6 oz
Instant coffee,Nescafe Ice Roast Instant Coffee Sticks,4.57,0.57,ct,8 ct
Instant coffee,Sally Hansen Insta-Dri Nail Polish - Instant Coffee,5.98,,,
Instant coffee,Postum Natural Coffee Flavor Instant Coffee Alternative,10.68,1.34,oz,8 oz
Instant coffee,Nescafe Gold Decaf Expresso Instant Coffee Mix,9.24,2.64,oz,3.5 oz
Instant coffee,Community Coffee Breakfast Blend Medium Roast Instant Coffee,10.99,1.57,oz,7 oz
Instant coffee,Community Coffee Signature Blend Dark Roast Instant Coffee,10.99,1.57,oz,7 oz
Instant coffee,Community Coffee Coffee & Chicory Medium-Dark Roast Instant Coffee,10.99,1.57,oz,7 oz
Instant coffee,Community Coffee Decaf Cafe Special Medium-Dark Roast Instant Coffee,10.99,1.57,oz,7 oz
Instant coffee,Starbucks Via Ready Brew Pikes Place Roast Medium Roast Instant Coffee,8.47,1.06,ct,8 ct
Instant coffee,Nescafe Tasters Choice Decaf Instant Coffee,12.57,1.8,oz,7 oz
Instant coffee,Central Market Organics Decaffeinated Instant Coffee,6.98,1.99,oz,3.5 oz
Instant coffee,Folgers Coffee Singles Classic Decaf Instant Coffee Bags,7.98,0.42,ct,19 ct
Instant coffee,H-E-B Cafe Puro Instant Decaf Coffee,6.78,0.97,oz,7 oz
Instant coffee,Chike 20g Whey Protein Iced Coffee - Mocha,29.63,1.94,oz,15.3 oz
Instant coffee,Chike 20g Whey Protein Iced Coffee - Original,29.63,1.85,oz,15.3 oz
Instant coffee,Maxwell House International Cafe Francais Beverage Mix,4.46,0.59,oz,7.6 oz
Instant coffee,Hills Bros. Sugar Free French Vanilla Cappuccino Drink Mix,4.22,0.35,oz,12 oz
Instant coffee,Maxwell House International Cafe Cafe Vienna Beverage Mix,4.46,0.5,oz,9 oz
Instant coffee,Folgers Classic Decaf Single Serve Coffee Packets,1.46,0.24,ct,6 ct
Instant coffee,Maxwell House International Cafe  Suisse Mocha Beverage Mix,4.46,0.62,oz,7.2 oz
Instant coffee,Hills Bros. English Toffee Cappuccino Drink Mix,4.22,0.26,oz,16 oz
Instant coffee,Maxwell House International Cafe Sugar Free Suisse Mocha Decaffeinated Beverage Mix,4.46,1.01,oz,4 oz
Instant coffee,Maxwell House International Cafe Sugar Free French Vanilla Beverage Mix,4.46,1.04,oz,4.3 OZ
Instant coffee,DeLallo Instant Espresso Powder,4.77,2.46,oz,1.94 oz
Instant coffee,Caffe D'Vita Premium Instant Sugar Free Mocha Cappuccino,5.82,0.68,oz,8.5 oz
Instant coffee,Maxwell House International Cafe Hazelnut Beverage Mix,4.46,0.5,oz,9 oz
Colored Pencils,H-E-B Presharpened Colored Pencils,2.38,,,24 pk
Colored Pencils,H-E-B Presharpened Colored Pencils,0.97,,,12 pk
Colored Pencils,Crayola Twistables Colored Pencils,2.97,0.25,ct,12 pk
Colored Pencils,Crayola Erasable Colored Pencils,5.88,0.24,ct,24 pk
Colored Pencils,H-E-B Bright Colored Pencils,1.47,,,8 pk
Colored Pencils,H-E-B Metallic Colored Pencils,1.47,,,8 pk
Colored Pencils,H-E-B Presharpened Colored Pencils,3.47,,,36 pk
Colored Pencils,Zebra Zensations Colored Pencils - Assorted Ink,10.79,0.9,pack,12 pk
Colored Pencils,Cra-Z-Art Neon Colored Pencils,4.48,0.37,ct,12 pk
Colored Pencils,Prismacolor Premier Soft Core Colored Pencils,12.99,1.08,ct,12 pk
Colored Pencils,Crayola Signature Blend & Shade Colored Pencils,19.99,,,24 pk
Colored Pencils,Faber-Castell Black Edition Color Pencils - Neon & Pastel,9.99,0.83,ct,12 pk
Colored Pencils,Crayola Pre-Sharpened Colored Pencils,3.27,0.14,ct,24 pk
Colored Pencils,Crayola Pre-Sharpened Colored Pencils,2.17,0.18,ct,12 pk
Colored Pencils,Crayola Silly Scents Colored Pencils,4.97,,,12 pk
Colored Pencils,Art 101 Colored Pencil On The Go Art Kit,2.97,,,11 pc
Colored Pencils,H-E-B Presharpened Colored Pencils,4.98,,,50 pk
Colored Pencils,Evolve Latex Free Pencil Grips - Multi Color,1.27,,,10 pc
Colored Pencils,Maped Universal Retractable Eraser - Assorted Colors,1.47,,,
Colored Pencils,Pilot V-Board Master BeGreen Dry-Erase Markers - Assorted Colors,6.97,1.39,ct,5 pk
Orange Juice,Simply Pulp Free 100% Orange Juice,0.09,0.09,oz,76 oz
Orange Juice,Simply Orange Pulp Free 100% Pure Squeezed Orange Juice,0.16,0.16,oz,8 oz
Orange Juice,H-E-B 100% Orange Juice - No Pulp,0.09,0.09,oz,52 oz
Orange Juice,Simply Orange Pulp Free 100% Pure Squeezed Orange Juice,0.1,0.1,oz,46 oz
Orange Juice,H-E-B 100% Orange Juice - No Pulp,0.08,0.08,oz,89 oz
Orange Juice,Hill Country Fare Orange Juice - Original,0.05,0.05,oz,1 gal
Orange Juice,H-E-B 100% Orange Juice - Some Pulp,0.09,0.09,oz,52 oz
Orange Juice,Sunny D Tangy Original Orange Flavored Citrus Punch,0.03,0.03,oz,1 gal
Orange Juice,Minute Maid 100% Orange Juice 6 pk Bottles,0.09,0.09,oz,10 oz
Orange Juice,H-E-B 100% Orange Juice - Some Pulp,0.08,0.08,oz,89 oz
Orange Juice,H-E-B Fresh Orange Juice,0.19,0.19,oz,52 fl oz
Orange Juice,Minute Maid Pulp Free Orange Juice,0.08,0.08,oz,59 oz
Orange Juice,H-E-B No Pulp Light Orange Juice,0.09,0.09,oz,52 oz
Orange Juice,Tropicana No Pulp Pure Premium Orange 100% Juice,0.09,0.09,oz,46 oz
Orange Juice,H-E-B Organics Fresh Orange Juice,0.19,0.19,oz,52 fl oz
Orange Juice,Simply Orange Pulp Free Orange Juice with Calcium & Vitamin D,0.1,0.1,oz,46 oz
Orange Juice,Minute Maid Original Low Pulp 100% Pure Squeezed Orange Juice,0.08,0.08,oz,59 oz
Orange Juice,H-E-B 100% Orange Juice - Lots of Pulp,0.09,0.09,oz,52 oz
Orange Juice,Florida's Natural No Pulp 100% Premium Florida Orange Juice,0.08,0.08,oz,52 oz
Orange Juice,H-E-B Organics 100% Valencia Orange Juice - No Pulp,0.1,0.1,oz,52 oz
Orange Juice,Tropicana Some Pulp Pure Premium 100% Orange Juice,0.09,0.09,oz,46 oz
Orange Juice,Simply Orange Pulp Free Orange Juice with Calcium & Vitamin D,0.09,0.09,oz,76 oz
Orange Juice,H-E-B 100% Orange Juice - No Pulp,0.15,0.15,oz,12 oz
Orange Juice,Tropicana No Pulp Light Orange Juice,0.09,,,46 oz
Orange Juice,H-E-B No Sugar Added 100% Orange Juice,0.09,0.09,oz,48 oz
Orange Juice,Simply Orange Pulp Free Orange Juice,0.18,0.18,oz,11.5 oz
Orange Juice,H-E-B No Sugar Added 100% Orange Juice,0.09,0.09,oz,64 oz
Orange Juice,H-E-B Fresh Orange Juice,0.25,0.25,oz,16 fl oz
Orange Juice,Simply Light Pulp Free Orange Juice,0.1,0.1,oz,46 oz
Orange Juice,Minute Maid Low Pulp 100% Pure Squeezed Orange Juice - Calcium & Vitamin D,0.08,0.08,oz,59 oz
Orange Juice,Dole 100% Pineapple Orange Juice,0.07,0.07,oz,52 oz
Orange Juice,Hill Country Fare Orange Juice with Calcium,0.07,0.07,oz,1/2 gal
Orange Juice,H-E-B Organics 100% Orange Juice,0.08,,,64 oz
Orange Juice,H-E-B Organics 100% Apple Grape Orange Juice 4 pk Boxes,0.7,0.7,pack,6.75 oz
Orange Juice,Hill Country Fare Orange Juice - Original,0.07,0.07,oz,1/2 gal
Orange Juice,Florida's Natural No Pulp 100% Premium Florida Orange Juice with Calcium & Vitamin D,0.08,0.08,oz,52 oz
Orange Juice,H-E-B Organics 100% Pasteurized Orange Juice 4 pk Juice Boxes,0.7,0.7,pack,6.75 oz
Orange Juice,Hill Country Fare Orange Juice with Calcium,0.05,0.05,oz,1 gal
Orange Juice,Florida's Natural Some Pulp 100% Premium Florida Orange Juice,0.08,0.08,oz,52 oz
Orange Juice,Tropicana Pure Premium No Pulp Orange Juice Calcium & Vitamin D,0.09,0.09,oz,89 oz
Orange Juice,Tropicana No Pulp Calcium & Vitamin D Light Orange Juice,0.09,0.09,oz,46 oz
Orange Juice,H-E-B Some Pulp Light Orange Juice,0.09,0.09,oz,52 oz
Orange Juice,Tropicana Lots of Pulp Pure Premium 100% Orange Juice,0.09,,,46 oz
Orange Juice,Tropicana Pure Premium No Pulp 100% Orange Juice,0.2,0.2,oz,11 oz
Orange Juice,Tropicana No Pulp Calcium & Vitamin D Pure Premium Orange Juice,0.09,0.09,oz,46 oz
Orange Juice,V8 Energy Sparkling Orange Pineapple Juice Energy Drink 4 pk Cans,0.11,0.11,oz,11.5 oz
Orange Juice,good2grow Bigger Orange Mango Juice,0.43,,,10 oz
Orange Juice,Welch's Orange Pineapple Juice 6 pk Bottles,0.07,0.07,oz,10 oz
Orange Juice,H-E-B Diet Pineapple Orange Guava Juice,0.05,0.05,oz,64 oz
Orange Juice,Hawaiian Punch Orange Ocean Juice Drink,0.03,0.03,oz,32 oz
Orange Juice,Dole 100% Pineapple Orange Banana Juice,0.07,0.07,oz,52 oz
Orange Juice,H-E-B Organics Orange Peach Mango Juice,0.09,0.09,oz,59 oz
Orange Juice,V8 Energy Orange Pineapple Juice Energy Drink 6 pk Cans,0.85,0.85,pack,8 oz
Orange Juice,Dole 100% Orange Strawberry Banana Juice,0.07,0.07,oz,52 oz
Orange Juice,Tropicana Pure Premium 100% Orange Juice,0.09,0.09,oz,89 oz
Orange Juice,H-E-B Organics 100% Orange Strawberry Banana Juice,0.09,0.09,oz,59 oz
Orange Juice,Hi-C Orange Lavaburst 8 pk Juice Boxes,0.05,0.05,oz,6 oz
Orange Juice,Dole 100% Orange Peach Mango Juice,0.07,0.07,oz,52 oz
Orange Juice,So Good So You Happy Blood Orange Guava Probiotic Juice Shot,1.93,1.93,oz,1.7 fl oz
Orange Juice,Simply Orange Pulp Free Orange with Mango 100% Juice Blend,0.18,0.18,oz,11.5 oz
Orange Juice,Just Made Passion Orange Guava Cold-Pressed Juice,0.28,0.28,oz,11.8 fl oz
Orange Juice,So Good So You Detox Pineapple Orange Cold-Pressed Probiotic Juice Shot,1.93,1.93,oz,1.7 fl oz
Orange Juice,Welch's 100% Orange Pineapple Apple Juice 6 pk Bottles,0.88,0.88,ct,10 oz
Orange Juice,Suja Detox Blood Orange Organic Cold-Pressed Shot,1.24,1.24,oz,2 fl oz
Orange Juice,Sunny D Smooth Orange Flavored Citrus Punch,0.03,0.03,oz,1 gal
Orange Juice,Sunny D Tangy Original Orange Flavored Citrus Punch,0.5,,,6.75 oz
Orange Juice,Kool-Aid Jammers Sharkleberry Fin Strawberry Orange Punch 10 pk Pouches,0.05,0.05,oz,6 oz
Orange Juice,Sunny D Tangy Original Orange Flavored Citrus Punch,0.03,0.03,oz,64 oz
Orange Juice,Plezi Juice Drink 8 pk Boxes - Orange Smash,0.07,0.07,oz,6.75 oz
Orange Juice,Tropicana Essentials No Pulp Orange Mango Blend,0.08,0.08,oz,46 oz
Orange Juice,Tropicana Essentials Orange Blend Some Pulp,0.08,0.08,oz,46 oz
Orange Juice,Tropicana Essentials No Pulp Orange Blend,0.08,0.08,oz,46 oz
Orange Juice,Just Made Lime Orange Agave Margarita Mix,0.21,0.21,oz,33.8 fl oz
Orange Juice,Tum-E Yummies Edgy Orange Burst,0.1,0.1,oz,10.1 oz
Orange Juice,Sunny D Orange Strawberry Flavored Citrus Punch,0.03,0.03,oz,1 gal
Orange Juice,Bright & Early by Hi-C Orange Drink,0.03,0.03,oz,59 oz
Orange Juice,Hawaiian Punch Orange Ocean Drink,0.02,0.02,oz,1 gal
Orange Juice,H-E-B Fresh Tangerine Juice,0.19,0.19,oz,52 fl oz
Orange Juice,Ruby Kist 100% Orange Juice,0.07,0.07,oz,64 oz
Twix Candy Bar,Twix Snickerdoodle Chocolate Candy Bar,1.11,1.11,oz,1.41 oz
Twix Candy Bar,Twix Caramel Cookie Snowmen Christmas Candy Bars - Share Size,1.2,1.2,oz,2.12 oz
Twix Candy Bar,"Twix Caramel Cookie Snowmen Christmas Candy Bars, 6 pk",0.99,0.99,oz,6.36 oz
Twix Candy Bar,Twix Caramel Milk Chocolate Minis Candy Bars - Treating Size,0.6,0.6,oz,5 oz
Twix Candy Bar,Twix Minis Cookie Chocolate Caramel Candy Bars - Party Size,0.42,0.42,oz,35.6 oz
Twix Candy Bar,"Twix Caramel Milk Chocolate Cookie Candy Bars, 6 pk",7.88,,,10.74 oz
Twix Candy Bar,Twix Caramel Chocolate Cookie Candy Bar - Share Size,0.84,0.84,oz,3.02 oz
Twix Candy Bar,Twix Caramel Cookie Snowmen Christmas Candy Bar,1.18,1.18,oz,1.06 oz
Twix Candy Bar,Twix Caramel Chocolate Cookie Candy Bar,1.57,,,1.79 oz
Twix Candy Bar,Twix Chocolate Caramel Fun Size Candy Bars,0.45,0.45,oz,5 pk
Twix Candy Bar,"Snickers, Twix, Milky Way, & 3 Musketeers  Assorted Full Size Chocolate Candy Bars - Variety Pack",21.78,,,18 pk
Twix Candy Bar,"Snickers, Twix, Milky Way, & 3 Musketeers Minis Milk Chocolate Candy Bars - Party Size",0.51,0.51,oz,19.49
Twix Candy Bar,"Snickers, Twix, Milky Way & 3 Musketeers Assorted Minis Chocolate Bars - Family Size",0.58,0.58,oz,13.72 oz
Twix Candy Bar,Twix Milk Chocolate Caramel Cookie Fun Size Candy Bars,0.45,0.45,oz,10.83 oz
Twix Candy Bar,Twix Minis Chocolate Bars - Sharing Size,0.51,0.51,oz,9.7 oz
Creamy Peanut Butter,H-E-B Made in Texas Creamy Peanut Butter,0.14,0.14,oz,28 oz
Creamy Peanut Butter,H-E-B Made in Texas Creamy Peanut Butter,0.15,0.15,oz,18 oz
Creamy Peanut Butter,Jif Creamy Peanut Butter,0.17,0.17,oz,40 oz
Creamy Peanut Butter,Jif Creamy Peanut Butter,0.17,0.17,oz,16 oz
Creamy Peanut Butter,Hill Country Fare Creamy Peanut Butter,0.11,0.11,oz,18 oz
Creamy Peanut Butter,Peter Pan Creamy Peanut Butter,0.15,0.15,oz,16.3 oz
Creamy Peanut Butter,Peter Pan Creamy Peanut Butter,0.14,0.14,oz,40 oz
Creamy Peanut Butter,H-E-B Organics 7g Protein Creamy Peanut Butter Spread,0.25,0.25,oz,18 oz
Creamy Peanut Butter,Hill Country Fare Creamy Peanut Butter,0.1,0.1,oz,40 oz
Creamy Peanut Butter,Central Market All-Natural Smooth Peanut Butter - Unsalted,0.2,0.2,oz,18 oz
Creamy Peanut Butter,H-E-B Made in Texas Creamy Peanut Butter – Texas-Size Pack Twin Pack,0.12,0.12,oz,40 oz each
Creamy Peanut Butter,Hill Country Fare Creamy Peanut Butter - Texas-Size Pack,0.1,0.1,oz,4 lbs
Creamy Peanut Butter,Laura Scudder's Old Fashioned All Natural Smooth Peanut Butter,0.3,0.3,oz,16 oz
Creamy Peanut Butter,H-E-B Natural 7g Protein Creamy Peanut Butter,0.12,0.12,oz,16 oz
Creamy Peanut Butter,Reese's Creamy Peanut Butter,0.2,0.2,oz,18 oz
Creamy Peanut Butter,H-E-B Made in Texas Creamy Peanut Butter - Texas Wildflower Honey,0.15,0.15,oz,18 oz
Creamy Peanut Butter,Skippy No Sugar Added Creamy Peanut Butter,0.19,0.19,oz,16 oz
Creamy Peanut Butter,Jif To Go Creamy Peanut Butter Cups,0.36,0.36,oz,8 ct
Creamy Peanut Butter,Skippy Natural Creamy Peanut Butter,0.18,0.18,oz,26.5 oz
Creamy Peanut Butter,Jif Creamy Peanut Butter,0.16,0.16,oz,4 lbs
Creamy Peanut Butter,think! 20g Protein Bars - Creamy Peanut Butter,1.71,1.71,ct,5 ct
Creamy Peanut Butter,Skippy Creamy Peanut Butter,0.16,0.16,oz,40 oz
Creamy Peanut Butter,Jif Natural Creamy Peanut Butter Spread,0.2,0.2,oz,28 oz
Creamy Peanut Butter,Homeplate Creamy Peanut Butter Spread,0.39,0.39,oz,16 oz
Creamy Peanut Butter,Skippy Squeeze Creamy Peanut Butter,0.41,0.41,oz,6 oz
Creamy Peanut Butter,Skippy Squeeze Natural Creamy Peanut Butter,0.41,0.41,oz,6 oz
Creamy Peanut Butter,Peter Pan Natural Creamy Peanut Butter Spread,0.15,0.15,oz,16.3 oz
Creamy Peanut Butter,Nut' N Better Organic Creamy Peanut Butter,0.29,0.29,oz,18 oz
Creamy Peanut Butter,Quinn Creamy Peanut Butter Filled Pretzel Nuggets,0.64,0.64,oz,7 oz
Creamy Peanut Butter,Genius Gourmet 10g Protein Bars - Creamy Peanut Butter Chocolate,1.74,1.74,pack,4 ct
Creamy Peanut Butter,Peter Pan Creamy Peanut Butter,0.14,0.14,oz,28 oz
Creamy Peanut Butter,Raw Rev Plant-Based 12g Protein Bar - Creamy Peanut Butter & Sea Salt,2.5,,,1.6 oz
Creamy Peanut Butter,Jif To Go Natural Creamy Peanut Butter Cups,0.36,0.36,oz,8 ct
Creamy Peanut Butter,Skippy Natural Creamy Peanut Butter Spread,0.2,0.2,oz,15 oz
Creamy Peanut Butter,Skippy Creamy Peanut Butter Individual Squeeze Pouches,0.32,0.32,oz,8 ct
Creamy Peanut Butter,Peter Pan Honey Roast Creamy Peanut Butter Spread,0.14,0.14,oz,28 oz
Creamy Peanut Butter,H-E-B Creamy Creations Peanut Butter Cup Ice Cream,0.11,,,1/2 gal
Creamy Peanut Butter,Skippy Creamy Peanut Butter,0.18,0.18,oz,16.3 oz
Creamy Peanut Butter,H-E-B Creamy Creations Peanut Butter Cup Ice Cream,0.16,,,1 pt
Creamy Peanut Butter,Jif Squeezable Creamy Peanut Butter Pouch,0.27,0.27,oz,13 oz
Creamy Peanut Butter,Skippy Natural Creamy Peanut Butter Individual Pouches,0.32,0.32,oz,8 ct
Creamy Peanut Butter,Peter Pan Creamy Honey Peanut Butter Spread,0.15,0.15,oz,16.3 oz
Creamy Peanut Butter,Jif Reduced Fat Creamy Peanut Butter Spread,0.17,0.17,oz,16 oz
Creamy Peanut Butter,Good Good No Added Sugar Creamy Peanut Butter,0.43,0.43,oz,16 oz
Creamy Peanut Butter,H-E-B Organics 7g Protein Creamy Peanut Butter Spread - Texas-Size Pack,0.25,0.25,oz,37 oz
Creamy Peanut Butter,Hill Country Fare PB&J Stripes - Creamy Peanut Butter & Grape Jelly,0.14,0.14,oz,18 oz
Creamy Peanut Butter,Nature Valley 10g Protein Creamy Crisp Bars - Peanut Butter Chocolate,0.79,0.79,ct,5 ct
Creamy Peanut Butter,Jif Creamy Peanut Butter Pack & Snack Pouches,0.34,0.34,oz,4 ct
Creamy Peanut Butter,Peter Pan Natural Creamy Peanut Butter,0.14,0.14,oz,40 oz
Creamy Peanut Butter,Nature Valley Peanut Butter Chocolate Crispy Creamy Wafer Bars,0.79,0.79,ct,5 ct
Creamy Peanut Butter,Nut' N Better Organic Creamy Peanut Butter - No Stir,0.29,0.29,oz,18 oz
Creamy Peanut Butter,MaraNatha Organic No Sugar Added Creamy Peanut Butter,0.34,0.34,oz,16 oz
Creamy Peanut Butter,Nature Valley Peanut Butter Crispy Creamy Wafer Bars,0.79,0.79,ct,5 ct
Creamy Peanut Butter,Skippy Natural Creamy Peanut Butter Spread with Honey,0.2,0.2,oz,15 oz
Creamy Peanut Butter,Jif Natural Simply Squeeze Creamy Peanut Butter Spread,0.27,0.27,oz,13 oz
Creamy Peanut Butter,H-E-B Natural 6g Protein Creamy Peanut Butter - Honey,0.12,0.12,oz,16 oz
Creamy Peanut Butter,Hill Country Fare PB&J Stripes - Creamy Peanut Butter & Strawberry Jelly,0.14,0.14,oz,18 oz
Creamy Peanut Butter,Lotus Biscoff Creamy Cookie Butter,0.39,0.39,oz,14.1 oz
Creamy Peanut Butter,Nutella Hazelnut Spread with Cocoa,0.38,0.38,oz,13 oz
Creamy Peanut Butter,Peter Pan Honey Roasted Creamy Peanut & Honey Spread,0.14,0.14,oz,40 oz
Creamy Peanut Butter,H-E-B Made in Texas Crunchy Peanut Butter,0.14,0.14,oz,28 oz
Creamy Peanut Butter,H-E-B Bulk Freshly Ground Peanut Butter,0.15,0.15,oz,lb
Creamy Peanut Butter,Justin's Classic Peanut Butter Spread,1.09,1.09,oz,1.15 oz
Creamy Peanut Butter,Justin's Honey Peanut Butter Spread,1.09,1.09,oz,1.15 oz
Creamy Peanut Butter,Peanut Butter & Co. Peanut Butter - White Chocolate Wonderful,0.3,0.3,oz,16 oz
Creamy Peanut Butter,H-E-B Almond Butter Stock,0.22,0.22,oz,lb
Creamy Peanut Butter,H-E-B Creamy Almond Butter - Cinnamon,0.44,0.44,oz,16 oz
Creamy Peanut Butter,Nutella & Go! Hazelnut Spread + Breadsticks,1.38,1.38,oz,1.8 oz
Creamy Peanut Butter,Central Market Smooth Peanut Butter with Honey - Salted,0.2,0.2,oz,18 oz
Creamy Peanut Butter,H-E-B Organics 7g Protein Crunchy Peanut Butter,0.25,0.25,oz,18 oz
Creamy Peanut Butter,MaraNatha All Natural No Stir Creamy Almond Butter,0.7,0.7,oz,12 oz
Creamy Peanut Butter,Barney Butter Smooth Almond Butter,1.3,1.3,oz,0.6 oz
Creamy Peanut Butter,SunButter Creamy Sunflower Butter On the Go Cups,0.72,0.72,oz,6 ct
Creamy Peanut Butter,MaraNatha No Salt No Sugar Creamy Almond Butter,0.7,0.7,oz,12 oz
Creamy Peanut Butter,Justin's Classic Almond Butter,0.86,0.86,oz,16 oz
Creamy Peanut Butter,Justin's Honey Almond Butter,0.86,0.86,oz,16 oz
Creamy Peanut Butter,Justin's Honey Almond Butter,1.29,1.29,oz,1.15 oz
Creamy Peanut Butter,MaraNatha All Natural Raw Creamy Almond Butter,0.73,0.73,oz,16 oz
Creamy Peanut Butter,Nutella Hazelnut Spread with Cocoa,0.36,0.36,oz,26.5 oz
Creamy Peanut Butter,Justin's Vanilla Almond Butter,1.29,1.29,oz,1.15 oz
Creamy Peanut Butter,Artisana Organics Raw Coconut Butter,0.85,0.85,oz,14 oz
Creamy Peanut Butter,Justin's Maple Almond Butter,0.86,0.86,oz,16 oz
Creamy Peanut Butter,Justin's Maple Almond Butter,1.29,1.29,oz,1.15 oz
Creamy Peanut Butter,H-E-B Creamy Almond Butter – Dark Chocolate,0.44,0.44,oz,16 oz
Creamy Peanut Butter,Justin's Chocolate Hazelnut Butter Blend,0.86,0.86,oz,16 oz
Creamy Peanut Butter,Smucker's Goober Peanut Butter & Strawberry Jelly Stripes,0.22,0.22,oz,18 oz
Creamy Peanut Butter,Barney Butter Bare Smooth Almond Butter,1.3,1.3,oz,0.6 oz
Creamy Peanut Butter,Barney Butter Bare Smooth Almond Butter,0.7,0.7,oz,10 oz
Creamy Peanut Butter,Barney Butter Almond Butter - Cocoa + Coconut,0.7,0.7,oz,10 oz
Creamy Peanut Butter,Nutella & Go! Hazelnut Spread + Pretzel Sticks,1.31,1.31,oz,1.9 oz
Creamy Peanut Butter,H-E-B No Sugar Added Creamy Almond Butter – Texas Size Pack,0.41,0.41,oz,32 oz
Creamy Peanut Butter,Nutella Hazelnut Spread with Cocoa,0.39,0.39,oz,7.7 oz
Creamy Peanut Butter,PBfit Classic Roasted Peanut Butter Powder,0.52,0.52,oz,24 oz
Creamy Peanut Butter,H-E-B Creamy Creations No Sugar Added Light Ice Cream - Peanut Butter Cup,0.11,,,1/2 gal
Creamy Peanut Butter,H-E-B Creamy Almond Butter - Honey,0.44,0.44,oz,16 oz
Creamy Peanut Butter,SunButter Original Sunflower Seed Butter,0.44,0.44,oz,16 oz
Creamy Peanut Butter,Once Again Unsweetened Creamy Cashew Butter,0.73,0.73,oz,16 oz
Creamy Peanut Butter,PBfit Cocoa Roasted Peanut Butter Powder,0.5,0.5,oz,24 oz
Creamy Peanut Butter,Justin's Chocolate Hazelnut & Almond Butter,1.29,1.29,oz,1.15 oz
Creamy Peanut Butter,Justin's Vanilla Almond Butter,0.86,0.86,oz,16 oz
Creamy Peanut Butter,Justin's Classic Almond Butter,1.29,1.29,oz,1.15 oz
Creamy Peanut Butter,Justin's Classic Peanut Butter,0.37,0.37,oz,16 oz
Creamy Peanut Butter,Justin's Honey Peanut Butter Blend,0.37,0.37,oz,16 oz
Creamy Peanut Butter,H-E-B No Sugar Added Creamy Almond Butter,0.27,0.27,oz,16 oz
Creamy Peanut Butter,Peanut Butter & Co. Peanut Butter - Dark Chocolatey Dreams,0.3,0.3,oz,16 oz
Creamy Peanut Butter,Barney Butter Smooth Almond Butter,0.7,0.7,oz,10 oz
Creamy Peanut Butter,H-E-B Creamy Almond Butter – Vanilla,0.44,0.44,oz,16 oz
Tampons,"Playtex Sport Tampons Multipack - Regular & Super, Unscented",0.21,0.21,ct,48 ct
Tampons,Tampax Pearl Tampons - Regular Super & Super Plus,0.24,0.24,ct,47 ct
Tampons,H-E-B Plastic Applicator Unscented Tampons – Absorbency Multipack,0.17,0.17,ct,36 ct
Tampons,"Tampax Pearl Tampons Trio Pack, Super/Super Plus/Ultra Unscented",0.26,0.26,ct,34 ct
Tampons,Tampax Pearl Tampons Regular Unscented,0.25,0.25,ct,36 ct
Tampons,"Tampax Pearl Tampons Super Absorbency, Unscented",0.25,0.25,ct,36 ct
Tampons,"Playtex Sport Tampons - Super, Unscented",0.22,0.22,ct,36 ct
Tampons,"Tampax Pearl Tampons Trio Pack, Light/Regular/Super Absorbency, Unscented",0.26,0.26,ct,34 ct
Tampons,L. Cotton Tampons Regular/Super Absorbency Multipack,0.36,0.36,ct,30 ct
